<?xml version="1.0" encoding="UTF-8"?>

<pedido xmlns:xs="http://www.w3.org/2001/XMLSchema-instance" xs:noNamespaceSchemaLocation="/home/diurno/Escritorio/html%20Lenguaje%20de%20Marcas/Tema%205/Validacion/xsd/ActividadFinal34XSD.xsd">

    <factura pago="Transferencia bancaria">

        <dni>12345678A</dni>
        <cliente>Rafael Nadal Perera</cliente>
        <fecha>2020-01-31</fecha>
        <dir_entrega cp="10004">

            <direccion>C/ La Paz</direccion>
            <localidad>Cáceres</localidad>
            <provincia>Cáceres</provincia>

        </dir_entrega>

    </factura>


    <articulos>

        <articulo codigo="aaa-111">

            <unidades>8</unidades>
            <precio>23.94</precio>

        </articulo>

        <articulo codigo="BBB-222">

            <unidades>15</unidades>
            <precio>29.04</precio>

        </articulo>

    </articulos>

</pedido>